{
  "schemaVersion": "1.0.0",
  "shareId": "share-adv-0001",
  "releaseIdentity": {
    "loopId": "loop.demo.hello-file",
    "semanticVersion": "1.0.0",
    "packageContentDigest": { "algorithm": "SHA-256", "digestHex": "bd0744455f140b0c49f72b83b21489ea512354a54ae7d43bef4e0489fd31181e", "byteLength": 4096 }
  },
  "engineVersion": "1.0.0",
  "terminalState": "FAILED_SAFE",
  "terminalReasonCategory": "ALL_REQUIRED_VERIFIERS_PASSED",
  "nodeStateSummary": { "publishedLoop": false, "totalNodeCountBucket": "ONE_TO_FIVE", "nodeIds": [] },
  "bucketingVersion": "fb-share-bucket-1",
  "durationBucket": "UNDER_10_SECONDS",
  "retryCountBucket": "ZERO",
  "aggregateCostBucket": "ZERO",
  "aggregateTokensBucket": "ZERO",
  "localCloudRatio": { "computed": false, "ratioVersion": "fb-ratio-1" },
  "capabilityCategories": [],
  "verificationClaim": { "label": "UNSIGNED", "claimText": "This receipt is unsigned: no local signing key was available. No continuity claim can be made at all." },
  "createdAtUtc": "2026-08-07T09:45:00Z"
}
